{
  "$schema": "../host.schema.json",
  "template": "minimal",
  "dev": { "cwd": null, "start": null, "url": null, "platform": null },
  "checks": {
    "typecheck": { "cmd": "npm run typecheck", "baseline": 0 },
    "lint": { "cmd": "npm run lint", "baseline": 0 },
    "test": { "cmd": "npm test", "baseline": 0 }
  },
  "git": { "trunk": "main", "release": null, "engagementBranch": null, "doc": null },
  "docs": { "root": null, "glossary": null, "gotchas": null, "local": null, "retired": null, "index": "AGENTS.md" },
  "records": { "product": null, "productTemplate": null, "design": [], "designDoc": null, "driftWatch": null },
  "memory": { "root": null, "archive": null, "doc": null, "gloss": null, "connectors": null },
  "issues": { "tracker": null, "ladder": null, "doc": null, "ask": null, "retired": true },
  "verify": { "mcp": null, "probes": null, "doc": null, "agent": null },
  "theme": { "dir": null, "registry": null, "contract": null, "generator": null, "doc": null },
  "components": { "dir": null, "install": null, "registry": null, "showcase": null, "doc": null },
  "surfaces": { "root": null, "unit": null, "doc": null, "route": null, "compositionDoc": null, "limits": null, "seam": null, "harnessMarkers": [], "receiveDoc": null }
}
