{
  "$schema": "../host.schema.json",
  "template": "react-native-expo",
  "dev": { "cwd": null, "start": "npx expo start --ios", "platform": "native" },
  "checks": {
    "typecheck": { "cmd": "tsc --build", "baseline": 0 },
    "lint": { "cmd": "npx expo lint", "baseline": 0 }
  },
  "git": { "trunk": "main", "release": null, "engagementBranch": null, "doc": null },
  "docs": { "root": "docs", "glossary": null, "gotchas": null, "local": null, "retired": null, "index": "AGENTS.md" },
  "records": { "product": null, "productTemplate": null, "design": [], "designDoc": null, "driftWatch": null },
  "memory": { "root": null, "archive": null, "doc": null, "gloss": null, "connectors": null },
  "issues": { "tracker": null, "ladder": null, "doc": null, "ask": null, "retired": true },
  "verify": { "mcp": null, "probes": null, "doc": null, "agent": null },
  "theme": { "dir": "src/constants", "registry": null, "contract": null, "generator": null, "doc": null },
  "components": { "dir": "src/components/ui", "install": null, "registry": null, "showcase": null, "doc": null },
  "surfaces": {
    "root": "src/app",
    "unit": "screen",
    "doc": null,
    "route": "/<name>",
    "compositionDoc": null,
    "limits": null,
    "seam": null,
    "harnessMarkers": [],
    "receiveDoc": null
  }
}
